{"schema_version":2,"id":"builtin_statistics_mode_extended","description":"Mode follows R2022b dimension-vector, tie-cell, NaN, class, and shaped-empty semantics.","source":"programs/builtin_statistics_mode_extended.m","tags":["r2022b","wire-v2","core-numeric-builtins","statistics","builtin-statistics-new","mode"],"expected":{"outcome":"ok","value":{"class":"cell","size":[1,18],"ndims":2,"numel":18,"complex":false,"kind":"cell","items":[{"class":"double","size":[1,1,2],"ndims":3,"numel":2,"complex":false,"kind":"numeric","real":["1","3"],"imag":["0","0"]},{"class":"double","size":[1,1,2],"ndims":3,"numel":2,"complex":false,"kind":"numeric","real":["2","2"],"imag":["0","0"]},{"class":"cell","size":[1,1,2],"ndims":3,"numel":2,"complex":false,"kind":"cell","items":[{"class":"double","size":[2,1],"ndims":2,"numel":2,"complex":false,"kind":"numeric","real":["1","2"],"imag":["0","0"]},{"class":"double","size":[2,1],"ndims":2,"numel":2,"complex":false,"kind":"numeric","real":["3","4"],"imag":["0","0"]}]},{"class":"double","size":[1,1],"ndims":2,"numel":1,"complex":false,"kind":"numeric","real":["1"],"imag":["0"]},{"class":"double","size":[1,1],"ndims":2,"numel":1,"complex":false,"kind":"numeric","real":["2"],"imag":["0"]},{"class":"cell","size":[1,1],"ndims":2,"numel":1,"complex":false,"kind":"cell","items":[{"class":"double","size":[2,1],"ndims":2,"numel":2,"complex":false,"kind":"numeric","real":["1","3"],"imag":["0","0"]}]},{"class":"double","size":[1,1],"ndims":2,"numel":1,"complex":false,"kind":"numeric","real":["1"],"imag":["0"]},{"class":"double","size":[1,1],"ndims":2,"numel":1,"complex":false,"kind":"numeric","real":["1"],"imag":["0"]},{"class":"cell","size":[1,1],"ndims":2,"numel":1,"complex":false,"kind":"cell","items":[{"class":"double","size":[3,1],"ndims":2,"numel":3,"complex":false,"kind":"numeric","real":["1","NaN","NaN"],"imag":["0","0","0"]}]},{"class":"single","size":[1,3],"ndims":2,"numel":3,"complex":false,"kind":"numeric","real":["NaN","NaN","NaN"],"imag":["0","0","0"]},{"class":"double","size":[1,3],"ndims":2,"numel":3,"complex":false,"kind":"numeric","real":["0","0","0"],"imag":["0","0","0"]},{"class":"cell","size":[1,3],"ndims":2,"numel":3,"complex":false,"kind":"cell","items":[{"class":"single","size":[1,0],"ndims":2,"numel":0,"complex":false,"kind":"numeric","real":[],"imag":[]},{"class":"single","size":[1,0],"ndims":2,"numel":0,"complex":false,"kind":"numeric","real":[],"imag":[]},{"class":"single","size":[1,0],"ndims":2,"numel":0,"complex":false,"kind":"numeric","real":[],"imag":[]}]},{"class":"int8","size":[1,1],"ndims":2,"numel":1,"complex":false,"kind":"integer","integer":[{"real":"1","imaginary":"0"}]},{"class":"double","size":[1,1],"ndims":2,"numel":1,"complex":false,"kind":"numeric","real":["2"],"imag":["0"]},{"class":"cell","size":[1,1],"ndims":2,"numel":1,"complex":false,"kind":"cell","items":[{"class":"int8","size":[1,1],"ndims":2,"numel":1,"complex":false,"kind":"integer","integer":[{"real":"1","imaginary":"0"}]}]},{"class":"char","size":[1,1],"ndims":2,"numel":1,"complex":false,"kind":"char","code_units":[97]},{"class":"double","size":[1,1],"ndims":2,"numel":1,"complex":false,"kind":"numeric","real":["2"],"imag":["0"]},{"class":"cell","size":[1,1],"ndims":2,"numel":1,"complex":false,"kind":"cell","items":[{"class":"char","size":[2,1],"ndims":2,"numel":2,"complex":false,"kind":"char","code_units":[97,98]}]}]}}}
