{
  "schema_version": 2,
  "id": "try_catch_without_handler",
  "description": "Try without catch swallows a runtime error, skips the protected tail, and continues afterward.",
  "source": "programs/try_catch_without_handler.m",
  "tags": ["r2022b", "wire-v2", "single-try-r2022b", "try-catch", "control-flow", "no-handler", "error"],
  "expected": {
    "outcome": "ok",
    "value": {
      "class": "double", "size": [1, 1], "ndims": 2, "numel": 1,
      "complex": false, "kind": "numeric", "real": ["11"], "imag": ["0"]
    }
  }
}
