{
  "schema_version": 2,
  "id": "builtin_matrix_functions_classes",
  "description": "inv, pinv, trace, cross, and kron preserve R2022b single, integer, and widening class rules.",
  "source": "programs/builtin_matrix_functions_classes.m",
  "tags": ["r2022b", "wire-v2", "core-numeric-builtins", "matrix-functions", "classes"],
  "expected": {
    "outcome": "ok",
    "value": {
      "class": "string",
      "size": [1, 8],
      "ndims": 2,
      "numel": 8,
      "complex": false,
      "kind": "string",
      "string_code_units": [
        [115, 105, 110, 103, 108, 101],
        [115, 105, 110, 103, 108, 101],
        [115, 105, 110, 103, 108, 101],
        [115, 105, 110, 103, 108, 101],
        [115, 105, 110, 103, 108, 101],
        [117, 105, 110, 116, 56],
        [105, 110, 116, 49, 54],
        [100, 111, 117, 98, 108, 101]
      ],
      "missing": [false, false, false, false, false, false, false, false]
    }
  }
}
