{
  "schema_version": 2,
  "id": "graphics_colormap_parula_r2022b",
  "description": "Default, resampled, custom, queried, and named parula colormaps follow MATLAB R2022b RGB rows and matrix orientation.",
  "source": "programs/graphics_colormap_parula_r2022b.m",
  "tags": [
    "r2022b",
    "wire-v2",
    "graphics",
    "plot-engine",
    "colormap",
    "parula"
  ],
  "expected": {
    "outcome": "ok",
    "value": {
      "class": "double",
      "size": [
        1,
        62
      ],
      "ndims": 2,
      "numel": 62,
      "complex": false,
      "kind": "numeric",
      "real": [
        "256",
        "3",
        "0.2422",
        "0.24440000000000001",
        "0.28110000000000002",
        "0.20660000000000001",
        "0.1321",
        "0.063799999999999996",
        "0.3548",
        "0.99490000000000001",
        "0.97689999999999999",
        "0.15040000000000001",
        "0.15340000000000001",
        "0.29299999999999998",
        "0.4743",
        "0.63629999999999998",
        "0.74460000000000004",
        "0.80159999999999998",
        "0.79149999999999998",
        "0.9839",
        "0.6603",
        "0.67279999999999995",
        "0.93520000000000003",
        "0.99260000000000004",
        "0.89319999999999999",
        "0.72919999999999996",
        "0.46689999999999998",
        "0.20119999999999999",
        "0.080500000000000002",
        "0.2422",
        "0.2021",
        "0.07039999999999999",
        "0.78580000000000005",
        "0.97689999999999999",
        "0.15040000000000001",
        "0.4788",
        "0.74570000000000003",
        "0.75727499999999992",
        "0.9839",
        "0.6603",
        "0.99109999999999998",
        "0.7258",
        "0.15984999999999999",
        "0.080500000000000002",
        "0",
        "0.29999999999999999",
        "0.59999999999999998",
        "0.10000000000000001",
        "0.40000000000000002",
        "0.69999999999999996",
        "0.20000000000000001",
        "0.5",
        "0.80000000000000004",
        "0.2422",
        "0.07039999999999999",
        "0.97689999999999999",
        "0.15040000000000001",
        "0.74570000000000003",
        "0.9839",
        "0.6603",
        "0.7258",
        "0.080500000000000002"
      ],
      "imag": [
        "0",
        "0",
        "0",
        "0",
        "0",
        "0",
        "0",
        "0",
        "0",
        "0",
        "0",
        "0",
        "0",
        "0",
        "0",
        "0",
        "0",
        "0",
        "0",
        "0",
        "0",
        "0",
        "0",
        "0",
        "0",
        "0",
        "0",
        "0",
        "0",
        "0",
        "0",
        "0",
        "0",
        "0",
        "0",
        "0",
        "0",
        "0",
        "0",
        "0",
        "0",
        "0",
        "0",
        "0",
        "0",
        "0",
        "0",
        "0",
        "0",
        "0",
        "0",
        "0",
        "0",
        "0",
        "0",
        "0",
        "0",
        "0",
        "0",
        "0",
        "0",
        "0"
      ]
    }
  }
}
