{
  "schema_version": 2,
  "id": "graphics_2d_plot_linespec_namevalue",
  "description": "LineSpec parsing followed by name/value overrides exposes a scalar Line and the final public style properties.",
  "source": "programs/graphics_2d_plot_linespec_namevalue.m",
  "tags": [
    "r2022b",
    "wire-v2",
    "graphics",
    "plot-engine",
    "graphics-2d",
    "plot",
    "linespec",
    "properties"
  ],
  "expected": {
    "outcome": "ok",
    "value": {
      "class": "cell",
      "size": [
        1,
        7
      ],
      "ndims": 2,
      "numel": 7,
      "complex": false,
      "kind": "cell",
      "items": [
        {
          "class": "char",
          "size": [
            1,
            36
          ],
          "ndims": 2,
          "numel": 36,
          "complex": false,
          "kind": "char",
          "code_units": [
            109,
            97,
            116,
            108,
            97,
            98,
            46,
            103,
            114,
            97,
            112,
            104,
            105,
            99,
            115,
            46,
            99,
            104,
            97,
            114,
            116,
            46,
            112,
            114,
            105,
            109,
            105,
            116,
            105,
            118,
            101,
            46,
            76,
            105,
            110,
            101
          ]
        },
        {
          "class": "double",
          "size": [
            1,
            2
          ],
          "ndims": 2,
          "numel": 2,
          "complex": false,
          "kind": "numeric",
          "real": [
            "1",
            "1"
          ],
          "imag": [
            "0",
            "0"
          ]
        },
        {
          "class": "double",
          "size": [
            1,
            3
          ],
          "ndims": 2,
          "numel": 3,
          "complex": false,
          "kind": "numeric",
          "real": [
            "0.125",
            "0.25",
            "0.5"
          ],
          "imag": [
            "0",
            "0",
            "0"
          ]
        },
        {
          "class": "char",
          "size": [
            1,
            1
          ],
          "ndims": 2,
          "numel": 1,
          "complex": false,
          "kind": "char",
          "code_units": [
            58
          ]
        },
        {
          "class": "double",
          "size": [
            1,
            1
          ],
          "ndims": 2,
          "numel": 1,
          "complex": false,
          "kind": "numeric",
          "real": [
            "2.5"
          ],
          "imag": [
            "0"
          ]
        },
        {
          "class": "char",
          "size": [
            1,
            1
          ],
          "ndims": 2,
          "numel": 1,
          "complex": false,
          "kind": "char",
          "code_units": [
            111
          ]
        },
        {
          "class": "double",
          "size": [
            1,
            1
          ],
          "ndims": 2,
          "numel": 1,
          "complex": false,
          "kind": "numeric",
          "real": [
            "9"
          ],
          "imag": [
            "0"
          ]
        }
      ]
    }
  }
}
