{
  "schema_version": 2,
  "id": "matrix_right_complex_relation",
  "description": "Rectangular complex right division agrees with the conjugate-transposed left-division relation.",
  "source": "programs/matrix_right_complex_relation.m",
  "tags": ["r2022b", "wire-v2", "numeric", "matrix-division", "right-divide", "underdetermined", "complex", "conjugate-transpose"],
  "expected": {
    "outcome": "ok",
    "value": {
      "class": "double",
      "size": [1, 6],
      "ndims": 2,
      "numel": 6,
      "complex": true,
      "kind": "numeric",
      "real": ["1.4999999999999993", "1.999999999999999", "0", "0", "0", "0"],
      "imag": ["0.49999999999999956", "1", "0", "0", "0", "0"],
      "tolerance": {"absolute": 1e-12, "relative": 1e-12}
    }
  }
}
