{
  "schema_version": 2,
  "id": "graphics_3d_surf_defaults",
  "description": "surf(Z) creates a MATLAB Surface with structured default coordinates, color data, styles, limits, and three-dimensional view.",
  "source": "programs/graphics_3d_surf_defaults.m",
  "tags": ["r2022b", "wire-v2", "graphics", "plot-engine", "graphics-3d", "surf"],
  "expected": {
    "outcome": "ok",
    "value": {
      "class": "double", "size": [1, 48], "ndims": 2, "numel": 48,
      "complex": false, "kind": "numeric",
      "real": ["1", "1", "3", "3", "1", "3", "3", "1", "2", "3", "1", "2", "3", "1", "2", "1", "2", "5", "2", "1", "2", "1", "1", "2", "1", "2", "5", "2", "1", "2", "1", "-37.5", "30", "1", "5", "1", "5", "1", "1", "0.5", "1", "1", "1", "1", "1", "1", "1", "1"],
      "imag": ["0", "0", "0", "0", "0", "0", "0", "0", "0", "0", "0", "0", "0", "0", "0", "0", "0", "0", "0", "0", "0", "0", "0", "0", "0", "0", "0", "0", "0", "0", "0", "0", "0", "0", "0", "0", "0", "0", "0", "0", "0", "0", "0", "0", "0", "0", "0", "0"]
    }
  }
}
