{"schema_version":2,"id":"builtin_math_constants_extended","description":"Floating-point constants, eps spacing, class selection, special values, and empty shapes match MATLAB R2022b.","source":"programs/builtin_math_constants_extended.m","tags":["r2022b","wire-v2","core-numeric-builtins","math-extended","constants","special-values"],"expected":{"outcome":"ok","value":{"class":"double","size":[1,21],"ndims":2,"numel":21,"complex":false,"kind":"numeric","real":["2.2204460492503131e-16","1.1920928955078125e-07","4.9406564584124654e-324","2.2204460492503131e-16","4.4408920985006262e-16","2.384185791015625e-07","4.4408920985006262e-16","2.2250738585072014e-308","1.1754943508222875e-38","1.7976931348623157e+308","3.4028234663852886e+38","9007199254740992","16777216","+Inf","NaN","1","0","3","1","2","0"],"imag":["0","0","0","0","0","0","0","0","0","0","0","0","0","0","0","0","0","0","0","0","0"]}}}
