{"schema_version":2,"id":"builtin_factorization_single_complex","description":"Complex single LU, economy QR, Cholesky, and determinant remain native binary32 while satisfying permutation and reconstruction contracts.","source":"programs/builtin_factorization_single_complex.m","tags":["r2022b","wire-v2","core-numeric-builtins","core-numeric-builtins-r3","linear-algebra","lu","qr","cholesky","determinant","single","complex"],"expected":{"outcome":"ok","value":{"class":"single","size":[1,6],"ndims":2,"numel":6,"complex":true,"kind":"numeric","real":["-1","0","0","0","0","2"],"imag":["3","0","0","0","0","0"],"tolerance":{"absolute":1e-5,"relative":1e-5}}}}
