{"schema_version":2,"id":"builtin_polynomial_convolution_values","description":"conv, conv2, and two-output deconv preserve R2022b column-major values and shape windows.","source":"programs/builtin_polynomial_convolution_values.m","tags":["r2022b","wire-v2","core-numeric-builtins","goal-polynomial","polynomial","convolution"],"expected":{"outcome":"ok","value":{"class":"double","size":[1,23],"ndims":2,"numel":23,"complex":false,"kind":"numeric","real":["1","3","5","3","3","5","3","3","5","1","6","9","4","20","24","4","16","16","1","2","0","0","0"],"imag":["0","0","0","0","0","0","0","0","0","0","0","0","0","0","0","0","0","0","0","0","0","0","0"],"tolerance":{"absolute":1e-12,"relative":1e-12}}}}
