{
  "schema_version": 2,
  "id": "aggregate_c3_comma_assign",
  "description": "Cell braces and struct fields produce ordered comma lists consumed by multi-target assignment.",
  "source": "programs/aggregate_c3_comma_assign.m",
  "tags": [
    "r2022b",
    "wire-v2",
    "aggregate",
    "c3",
    "cell",
    "struct",
    "comma-list",
    "assignment"
  ],
  "expected": {
    "outcome": "ok",
    "value": {
      "class": "cell",
      "size": [
        1,
        8
      ],
      "ndims": 2,
      "numel": 8,
      "complex": false,
      "kind": "cell",
      "items": [
        {
          "class": "double",
          "size": [
            1,
            1
          ],
          "ndims": 2,
          "numel": 1,
          "complex": false,
          "kind": "numeric",
          "real": [
            "11"
          ],
          "imag": [
            "0"
          ]
        },
        {
          "class": "double",
          "size": [
            1,
            1
          ],
          "ndims": 2,
          "numel": 1,
          "complex": false,
          "kind": "numeric",
          "real": [
            "33"
          ],
          "imag": [
            "0"
          ]
        },
        {
          "class": "double",
          "size": [
            1,
            1
          ],
          "ndims": 2,
          "numel": 1,
          "complex": false,
          "kind": "numeric",
          "real": [
            "22"
          ],
          "imag": [
            "0"
          ]
        },
        {
          "class": "cell",
          "size": [
            2,
            2
          ],
          "ndims": 2,
          "numel": 4,
          "complex": false,
          "kind": "cell",
          "items": [
            {
              "class": "double",
              "size": [
                1,
                1
              ],
              "ndims": 2,
              "numel": 1,
              "complex": false,
              "kind": "numeric",
              "real": [
                "101"
              ],
              "imag": [
                "0"
              ]
            },
            {
              "class": "double",
              "size": [
                1,
                1
              ],
              "ndims": 2,
              "numel": 1,
              "complex": false,
              "kind": "numeric",
              "real": [
                "33"
              ],
              "imag": [
                "0"
              ]
            },
            {
              "class": "double",
              "size": [
                1,
                1
              ],
              "ndims": 2,
              "numel": 1,
              "complex": false,
              "kind": "numeric",
              "real": [
                "22"
              ],
              "imag": [
                "0"
              ]
            },
            {
              "class": "double",
              "size": [
                1,
                1
              ],
              "ndims": 2,
              "numel": 1,
              "complex": false,
              "kind": "numeric",
              "real": [
                "404"
              ],
              "imag": [
                "0"
              ]
            }
          ]
        },
        {
          "class": "double",
          "size": [
            1,
            1
          ],
          "ndims": 2,
          "numel": 1,
          "complex": false,
          "kind": "numeric",
          "real": [
            "1"
          ],
          "imag": [
            "0"
          ]
        },
        {
          "class": "double",
          "size": [
            1,
            1
          ],
          "ndims": 2,
          "numel": 1,
          "complex": false,
          "kind": "numeric",
          "real": [
            "2"
          ],
          "imag": [
            "0"
          ]
        },
        {
          "class": "double",
          "size": [
            1,
            1
          ],
          "ndims": 2,
          "numel": 1,
          "complex": false,
          "kind": "numeric",
          "real": [
            "3"
          ],
          "imag": [
            "0"
          ]
        },
        {
          "class": "struct",
          "size": [
            1,
            3
          ],
          "ndims": 2,
          "numel": 3,
          "complex": false,
          "kind": "struct",
          "fields": [
            "beta",
            "alpha"
          ],
          "records": [
            {
              "beta": {
                "class": "double",
                "size": [
                  1,
                  1
                ],
                "ndims": 2,
                "numel": 1,
                "complex": false,
                "kind": "numeric",
                "real": [
                  "1"
                ],
                "imag": [
                  "0"
                ]
              },
              "alpha": {
                "class": "char",
                "size": [
                  1,
                  4
                ],
                "ndims": 2,
                "numel": 4,
                "complex": false,
                "kind": "char",
                "code_units": [
                  108,
                  101,
                  102,
                  116
                ]
              }
            },
            {
              "beta": {
                "class": "double",
                "size": [
                  1,
                  1
                ],
                "ndims": 2,
                "numel": 1,
                "complex": false,
                "kind": "numeric",
                "real": [
                  "2"
                ],
                "imag": [
                  "0"
                ]
              },
              "alpha": {
                "class": "char",
                "size": [
                  1,
                  1
                ],
                "ndims": 2,
                "numel": 1,
                "complex": false,
                "kind": "char",
                "code_units": [
                  98
                ]
              }
            },
            {
              "beta": {
                "class": "double",
                "size": [
                  1,
                  1
                ],
                "ndims": 2,
                "numel": 1,
                "complex": false,
                "kind": "numeric",
                "real": [
                  "3"
                ],
                "imag": [
                  "0"
                ]
              },
              "alpha": {
                "class": "char",
                "size": [
                  1,
                  5
                ],
                "ndims": 2,
                "numel": 5,
                "complex": false,
                "kind": "char",
                "code_units": [
                  114,
                  105,
                  103,
                  104,
                  116
                ]
              }
            }
          ]
        }
      ]
    }
  }
}
