{"schema_version":2,"id":"table_readtable_text_inference","description":"readtable preserves R2022b numeric inference, missing numeric values, variable naming rules, and char versus string text columns.","source":"programs/table_readtable_text_inference.m","tags":["r2022b","wire-v2","table","file-io","readtable","csv"],"expected":{"outcome":"ok","value":{"class":"cell","size":[1,2],"ndims":2,"numel":2,"complex":false,"kind":"cell","items":[{"class":"table","size":[2,3],"ndims":2,"numel":6,"complex":false,"kind":"table","variableNames":["FirstName","x1value","FirstName_1"],"variables":[{"class":"string","size":[2,1],"ndims":2,"numel":2,"complex":false,"kind":"string","string_code_units":[[65,100,97],[76,105,110,117,115]],"missing":[false,false]},{"class":"double","size":[2,1],"ndims":2,"numel":2,"complex":false,"kind":"numeric","real":["10","NaN"],"imag":["0","0"]},{"class":"double","size":[2,1],"ndims":2,"numel":2,"complex":false,"kind":"numeric","real":["1.5","2.5"],"imag":["0","0"]}]},{"class":"table","size":[2,3],"ndims":2,"numel":6,"complex":false,"kind":"table","variableNames":["First Name","1value","First Name_1"],"variables":[{"class":"cell","size":[2,1],"ndims":2,"numel":2,"complex":false,"kind":"cell","items":[{"class":"char","size":[1,3],"ndims":2,"numel":3,"complex":false,"kind":"char","code_units":[65,100,97]},{"class":"char","size":[1,5],"ndims":2,"numel":5,"complex":false,"kind":"char","code_units":[76,105,110,117,115]}]},{"class":"double","size":[2,1],"ndims":2,"numel":2,"complex":false,"kind":"numeric","real":["10","NaN"],"imag":["0","0"]},{"class":"double","size":[2,1],"ndims":2,"numel":2,"complex":false,"kind":"numeric","real":["1.5","2.5"],"imag":["0","0"]}]}]}}}
